{
  "$schema": "https://jollyrogercharter.org/spec/jrc-0.1.schema.json",
  "jrc": "0.1",
  "project": {
    "name": "charter",
    "repository": "https://github.com/jollyrogercharter/charter"
  },
  "assessment": {
    "kind": "self",
    "assessor": "REPLACE: your name, handle or role (no email)",
    "date": "2026-10-18",
    "commit": "37365e155664b685b7bb7f93757dc05089073dd6",
    "method": "Starting point generated by jrc assess from public files at commit 37365e1. Each claim only says a file exists; review every claim and gap before publishing."
  },
  "pillars": {
    "code_rights": {
      "status": "partial",
      "claims": [
        {
          "id": "licence-declared",
          "statement": "The licence is published in the repository.",
          "evidence": [
            {
              "kind": "file",
              "path": "LICENSE",
              "sha256": "a2010f343487d3f7618affe54f789f5487602331c0a8d03f49e9a7c547cf0499"
            }
          ],
          "verification": {
            "level": "self-reported"
          }
        },
        {
          "id": "licence-permits-reuse",
          "statement": "The declared licence permits copying, modification, resale and forking.",
          "evidence": [
            {
              "kind": "file",
              "path": "LICENSE",
              "sha256": "a2010f343487d3f7618affe54f789f5487602331c0a8d03f49e9a7c547cf0499"
            },
            {
              "kind": "file",
              "path": "package.json",
              "sha256": "42403253db7fd69fb246d411892918847dd370f2d5fc5ef196f36e7808d63624"
            }
          ],
          "verification": {
            "level": "self-reported"
          }
        },
        {
          "id": "dependency-lock",
          "statement": "Dependency versions are pinned in a lockfile.",
          "evidence": [
            {
              "kind": "file",
              "path": "package-lock.json"
            }
          ],
          "verification": {
            "level": "self-reported"
          }
        },
        {
          "id": "dependency-inventory",
          "statement": "A dependency or third-party licence inventory is published.",
          "evidence": [
            {
              "kind": "file",
              "path": "NOTICE.md"
            }
          ],
          "verification": {
            "level": "self-reported"
          }
        }
      ],
      "gaps": []
    },
    "development": {
      "status": "partial",
      "claims": [
        {
          "id": "readme",
          "statement": "A README describes the project.",
          "evidence": [
            {
              "kind": "file",
              "path": "README.md",
              "sha256": "e87d9271b0976a05437598598d47f71ef64d5d4c14ceb52b50cf494c76a8ec90"
            }
          ],
          "verification": {
            "level": "self-reported"
          }
        },
        {
          "id": "build-instructions",
          "statement": "Build and install instructions are written down.",
          "evidence": [
            {
              "kind": "file",
              "path": "DEPLOYMENT.md",
              "sha256": "4bd59e6099b1f0c26d626940123efb7665a57dd66d3b78b2e5b11b054489ec8b"
            }
          ],
          "verification": {
            "level": "self-reported"
          }
        },
        {
          "id": "tests",
          "statement": "Automated tests are in the repository.",
          "evidence": [
            {
              "kind": "file",
              "path": "test"
            },
            {
              "kind": "file",
              "path": "test/site.test.mjs"
            }
          ],
          "verification": {
            "level": "self-reported"
          }
        },
        {
          "id": "ci",
          "statement": "Continuous integration builds and tests the project in public.",
          "evidence": [
            {
              "kind": "file",
              "path": ".github/workflows/ci.yml"
            }
          ],
          "verification": {
            "level": "self-reported"
          }
        },
        {
          "id": "decision-records",
          "statement": "Design decisions are recorded in the repository.",
          "evidence": [
            {
              "kind": "file",
              "path": "launch/RFC-SEEDS.md"
            }
          ],
          "verification": {
            "level": "self-reported"
          }
        },
        {
          "id": "agent-records",
          "statement": "Instructions for AI agents working on the project are published.",
          "evidence": [
            {
              "kind": "file",
              "path": "AGENTS.md"
            }
          ],
          "verification": {
            "level": "self-reported"
          }
        }
      ],
      "gaps": []
    },
    "data": {
      "status": "not-started",
      "claims": [],
      "gaps": [
        "Decide whether this project holds user data. If it doesn't, set status to not-applicable and say why in applicability.",
        "How user data is handled is not documented.",
        "User data export and migration are not documented."
      ]
    },
    "operations": {
      "status": "partial",
      "claims": [
        {
          "id": "deploy-docs",
          "statement": "How to deploy and run the project is documented.",
          "evidence": [
            {
              "kind": "file",
              "path": "DEPLOYMENT.md",
              "sha256": "4bd59e6099b1f0c26d626940123efb7665a57dd66d3b78b2e5b11b054489ec8b"
            }
          ],
          "verification": {
            "level": "self-reported"
          }
        },
        {
          "id": "backup-restore",
          "statement": "Backup, restore or rollback is described.",
          "evidence": [
            {
              "kind": "file",
              "path": "DEPLOYMENT.md",
              "sha256": "4bd59e6099b1f0c26d626940123efb7665a57dd66d3b78b2e5b11b054489ec8b"
            }
          ],
          "verification": {
            "level": "self-reported"
          }
        },
        {
          "id": "release-process",
          "statement": "Releases and changes are documented.",
          "evidence": [
            {
              "kind": "file",
              "path": "CHANGELOG.md"
            }
          ],
          "verification": {
            "level": "self-reported"
          }
        }
      ],
      "gaps": [
        "Deployment configuration is not in the repository.",
        "No security reporting policy is published."
      ]
    },
    "economics": {
      "status": "partial",
      "claims": [
        {
          "id": "cost-records",
          "statement": "Operating costs are published in the repository.",
          "evidence": [
            {
              "kind": "file",
              "path": "launch/costs.json",
              "sha256": "43d8b804f2f67f8c079d93b57b3310e659638b780c964cfeb351ea947064bd1e"
            },
            {
              "kind": "file",
              "path": "product/QUARTERMASTER.md"
            }
          ],
          "verification": {
            "level": "self-reported"
          }
        }
      ],
      "gaps": [
        "Funding sources are not disclosed."
      ]
    },
    "governance": {
      "status": "partial",
      "claims": [
        {
          "id": "governance-doc",
          "statement": "How decisions are made and who maintains the project is documented.",
          "evidence": [
            {
              "kind": "file",
              "path": "community/GOVERNANCE-AND-DEBATE.md"
            }
          ],
          "verification": {
            "level": "self-reported"
          }
        },
        {
          "id": "open-proposals",
          "statement": "Anyone can propose changes through public issues or pull requests.",
          "evidence": [
            {
              "kind": "file",
              "path": ".github/ISSUE_TEMPLATE"
            }
          ],
          "verification": {
            "level": "self-reported"
          }
        }
      ],
      "gaps": [
        "Contribution instructions are not published.",
        "Approving changes may depend on a single person."
      ]
    }
  },
  "limitations": [
    "Generated from file names and a few fixed fields by an automated scan; nobody has reviewed these claims yet.",
    "No status is set to evidenced: that is the project's decision after review."
  ]
}
